{
  "meta": {
    "schema_version": "refraction_core_bundle_spec_v1",
    "timestamp_utc": "2025-01-01T12:00:00Z",
    "engine": {
      "name": "PyJHora",
      "version": "4.5.5"
    }
  },
  "person": {
    "id": "sample_person",
    "label": "Sample"
  },
  "config_echo": {
    "zodiac_type": "SIDEREAL",
    "ayanamsa_mode": "LAHIRI",
    "house_system": "5",
    "node_mode": "TRUE"
  },
  "frames": {
    "core_chart": { "meta": { "schema_version": "core_chart_spec_v1" } },
    "panchanga": { "meta": { "schema_version": "panchanga_spec_v1" } },
    "dashas_vimshottari": { "meta": { "schema_version": "dashas_vimshottari_spec_v1" } },
    "strengths": { "meta": { "schema_version": "strengths_spec_v1" } }
  }
}
